index_article,index_paragraph,content,label
7,13,"The Bayesian results were again substantiated by a frequentist multiple regression on the data aggregated across participant by Test Block and Test 1 accuracy indicating that Test Block and Test 1 accuracy explained a significant amount of variance in performance, F(3, 8) = 96.41, p < .001, R2 = .973, R2 Adjusted = .963). Moreover, the interaction of Test Bin and Previous Response was significant, 汕 = .016, t(8) = 3.83, p = .005. The slope of the change in performance across Test Block for Test 2 was shallower when the Test 1 response was correct (汕 = -.006) relative to when the Test 1 response was incorrect (汕 = -.022)",1
7,14,"In the current data, we observed that the pattern of output interference (OI) changed depending on whether it was the first or second time the set of questions had been answered. Specifically, no OI was observed during the initial test, but a robust OI effect was observed during the second test 每 after participants had received corrective feedback. Moreover, this OI was largely restricted to those questions for which the Test 1 response was incorrect. During the initial test, in the absence of recent episodic experience with the factual information, it is reasonable to presume that participants are searching knowledge (i.e., semantic memory), yet we observed no OI for Test 1. Participants could have recent experience with some of the information and, as a result, search episodic memory during Test 1, but such an occurrence would likely not be systematic. Critically, no OI was observed for Test 1. During the second test, it is reasonable to presume that participants are likely answering questions using a combination of knowledge and recent experience. For questions that were answered correctly during Test 1, participants could rely on knowledge as they presumably did during Test 1, to retrieve the correct answer. Of course, they could also search episodic memory. For questions that were answered incorrectly on Test 1, participants could rely on the episodic memory of the corrective feedback from Test 1 in order to answer Test 2. Of course they could also search knowledge, thought this is unlikely to lead to a correct answer given that it failed during Test 1. Importantly, Test 2 demonstrated a robust OI effect that was largely isolated to questions answered incorrectly during Test 1. We suggest that this indicates that OI is most pronounced for episodic memory.",1
7,15,"We therefore suggest that the best explanation of the data is the differential reliance on episodic and semantic memory to correctly answer questions. Episodic memory may be more susceptible to the sort of interference generated during testing (e.g., gradual changes in context, encoding/updating of items), whereas semantic memory is less so. Interestingly, attempting to reinstate encoding context, as suggested by many textbooks based on classic memory research (e.g., S. M. Smith, 1979) as a useful strategy for test taking, may be detrimental for tests intended to measure knowledge. That is, focusing on episodic retrieval using context information allows for interference from other information that matches the same context.",1
7,16,"In summary, we found that successive searches of knowledge do not suffer from OI using a set of general knowledge questions. However, OI was robust when participants presumably completed the test of knowledge by relying on episodic information, namely corrective feedback, provided during Test 1. These data provide potential constraints on the relationship between episodic and semantic memory",1
8,1,"The publication of this issue of Psychological Studies coincides with two important occasions that indicate the progress and development of psychology both as a field of study and research endeavor. First, Calcutta University is celebrating the centenary of Psychology Department which came into existence in the year 1915. Second, this journal is completing 60 years of its publication. These two events showcase the expansion and advancement of psychology in India in the last one century. Further, I am completing 15 years as Editor of this journal of the National Academy of Psychology (NAOP) India. Editing this journal has been a challenging and enriching experience for me. Significantly this task demands a consistent, sustained and collaborative effort. I could accomplish this responsibility with the timely help and support from the community of scholars. On account of personal reasons I found it extremely difficult to continue as Editor and the executive body of the NAOP kindly agreed to my request. I take this opportunity to express my sincere thanks to the NAOP officials and NAOP community for the conviction and trust shown during my tenure. The reviewers , associate editors and consulting editors of the journal have extended full support in editorial process. The administrative and production teams at Springer always helped in organizing the publication process.",1
8,2,"The last few decades have witnessed tremendous expansion of the discipline of psychology in many directions. It has happened in the domains of theory, research and practice. While psychometric, clinical and organizational subfields have continued to receive research attention a small but strong segment of researchers is showing change in their research agenda and increasingly engaging with indigenous concepts and methods. The choice of research issues and problems is showing greater degree of cultural sensibility",1
8,4,"In addition to regular articles the present issue of Psychological Studies includes a stimulating target article by Adrian Brock on Diversity and Presentism in the History of Psychology. It is followed by commentaries by several scholars including Jaan Valsiner and Svend Brinkmann, Christiane Hartnack, Anand Paranjpe and Nick Hopkins. Finally, there is a rejoinder by the author Adrian Brock. I hope the discussion will bring in new ideas and invite further work towards situating the discipline in proper socio-historical and cultural context. The issue also contains many other articles that attend to issues in the Indian context. Taken together the articles strengthen the endeavor to bring cultural sensibility to the center stage of psychological discourse.",1
8,5,"As I look back, my only regret is that we did not have an opportunity to be more innovative in handling the manuscripts. Attempts have been made to reduce the publication lag. The support from my associate editors and reviewers has facilitated the publication procedure. I hope that the process may be planned more effectively and creative use of the journal may be enhanced. The potential for improvements in the publication process is always present. We are very fortunate in having Professor Damodar Suar assuming the editorship of Psychological Studies. It is hoped that under the able editorship of Professor Suar the journal will continue to promote psychology. In addition to being a productive researcher he has been serving as Associate Editor of the journal. He is familiar with the functioning of the journal. I welcome him and his team. With Professor Damodar Suar as Editor the journal is in excellent hands. I wish him success in his endeavor.",1
9,1,"Whereas retrospective studies suggest that crying can be beneficial in terms of mood enhancement, results of quasi-experimental laboratory studies consistently demonstrate its negative effects on mood. The present study was specifically designed to evaluate a parsimonious explanation for this paradox by assessing mood after crying in a laboratory, both immediately and at follow up. Mood ratings of 28 objectively established criers and 32 non-criers were compared before and immediately after the exposure to an emotional movie, as well as 20 and 90 min later. As expected, immediately after the film, negative mood significantly increased in criers, while it did not change in noncriers. This mood deterioration was followed by a recovery that resulted in return to the baseline mood levels at the third measurement. Criers subsequently reported mood enhancements at the final measurement compared to the pre-film measurement. Crying frequency did not predict mood changes above those predicted by the presence of crying. The observed relation between crying and more long-term mood recovery reconciles seemingly contrasting earlier results and provides a simple and obvious explanation. After the initial deterioration of mood following crying that was observed in laboratory studies, it apparently takes some time for the mood, not just to recover, but also to become even less negative than before the emotional event, which corresponds to the results of retrospective studies.",1
9,2,"Humans are the only species having the capacity to shed emotional tears, a behavior that is very common and present in all cultures (Trimble 2012; Vingerhoets 2013; Vingerhoets and Bylsma 2015). Nevertheless, it has received little attention of researchers and the understanding of its functions is still very limited. Theories on the functions of crying can be classified into two global categories (Vingerhoets 2013; Vingerhoets et al. 2009). The first one emphasizes the putative intra-individual benefits of crying, the catharsis effect. According to this view, crying facilitates recovery and homeostatic processes. The alternative view emphasizes the inter-individual functions of crying, which are represented in the communication of one＊s helplessness and need for support, and whose effects are evident in elicitation of comfort and succor (Hasson 2009). These two positions are not mutually exclusive but rather supplemental, because receiving comfort and emotional support may also contribute to an increased well-being after crying. Seen from a stress theoretical perspective, crying may be considered as a kind of coping behavior, serving several functions, ranging from facilitation of emotional recovery to an ultimate effort to persuade others to do something about the situation (Vingerhoets 2013).",1
9,3,"When trying to explain these seemingly discrepant findings, some critical methodological issues need to be taken into account. In retrospective studies, participants are generally free to choose which crying episodes they describe. It has been suggested that such a design leaves the possibility that participants preferred to report crying experiences that fit the popular notion that one feels better after having cried (Cornelius 1997). An additional problem in these retrospective studies is that it is not possible to precisely define the time interval between the crying episode and the reported feeling. Participants are usually asked to report how they feel after having cried, without specification how they felt immediately, 10 min or 1 h after crying. One may, of course, wonder whether that would make any sense, that is, whether it is possible for participants to remember exactly the time course of their mood changes. However, it nevertheless could be that, after having cried, people typically first experience a dip in their mood, which is subsequently logically followed by a mood improvement. We currently simply lack the necessary information about the precise time course of mood changes after crying that would help us to understand the popular postulate of emotional recovery that follows tears",1
9,4,"The present study has been especially designed to examine the immediate and delayed effects of crying on mood in a laboratory setting. To increase generalizability and validity, we decided to use stimuli that provoke tears through a wide spectrum of negative and positive emotions. In accordance with the results obtained in previous laboratory studies (Cornelius 1997), we predicted that increases in negative mood (here termed as negative affect, NA) immediately after the potential crying每eliciting films would be more pronounced in participants who cried than in participants who did not cry. Furthermore, based on the results of previous retrospective studies, we anticipated that at the delayed mood measurements, participants who cried would experience greater mood improvement compared to participants who did not cry, both in terms of recovery after initial mood deterioration and of overall mood improvement (i.e., compared to the pre-film baseline values). We also anticipated the presence of a dose每response relationship between frequency of crying episodes and the changes in NA during the same time sequences.",1
9,5,The initial sample consisted of 46 female and 26 male students (age range 19每33; M = 23.80; SD = 3.19) who received course credits for participation. All participants provided written informed consent. Six participants were excluded from the analyses because of missing behavioural data due to equipment failure or because of incomplete questionnaire data.,1
9,6,"NA was assessed using the shortened version of the Emotional States Scale (Kardum and Bezinovic? 1992), containing 18 items on a five-point Likert scale ranging from 1 (I do not feel this way at all) to 5 (I feel this way completely). The items were: nervous, bad tempered, anxious, weepy, tense, guilty, helpless, sad, angry, miserable, rejected, fearful, cheerful, generous, relaxed, calm, active and merry (last six items reversely keyed). The scale showed adequate internal consistency, with the Cronbach＊s alphas over the four measurements ranging from .77 to .84",1
9,7,"Participants were individually seated in a sound attenuated room approximately 60 cm from a 19 in. monitor, speakers and video-camera. After having signed the informed consent form, they completed the first mood rating (T1), which was immediately followed by the random exposure to one of the two films. After having watched the film, participants first filled in a short questionnaire about their emotional responses to films that is not in the scope of this study. This was followed by the second mood measurement (T2) after which they were accompanied by the experimenter to another room. After they had filled in additional questionnaires also not in the scope of this study, 20 min following T2 participants completed the mood questionnaire for the third time (T3). After being shortly debriefed, participants were given additional instructions and a closed envelope containing the mood scale which they were requested to complete and return immediately after having received an SMS message via mobile phone. Each participant left the laboratory 120 min after the beginning of the experiment. The fourth mood measurement (T4) took place 90 min after the second one and 60 min after the participants left the laboratory. Participants were not given any instructions how to behave during the 60 min after leaving the laboratory and before T4. The answers to the T4 measure were sent to the experimenter via text messages in which participants returned 18 numbers representing their responses on the mood scale items.",1
9,8,"First, independent samples t test, Chi square tests, and Pearson correlation coefficients were calculated to test the relations between all the relevant variables, in order to test for the existence of possible confounding variables that have to be controlled for. Next, in order to examine whether the groups of participants who cried and who did not cry differed in changes in NA between the four measurements, a 4 9 2 mixed ANOVA was performed with time period as a within-subjects factor (measurements at T1, T2, T3 and T4), group (non-crying and crying) as betweensubjects factor, and age and gender as covariates. Changes within the groups and between specific measurements were analyzed by comparison of NA between points in time for which the hypotheses were made: between (1) T1每T2 (expected mood deterioration), (2) T1 and T4 (expected overall mood enhancement), and (3) T2每T4 (expected recovery), by using two separate within-subjects ANOVAs (for each group), and Bonferroni post hoc tests. To validate the possibility that low mood in criers stimulated (successful) mood enhancing behaviors, we also performed an additional ANOVA by including NA change from T1 to T2 as a covariate.",1
9,10,"A significant main effect of time [F(3, 53) = 5.64; p = .002; partial g2 = .09] and a significant time 9 group interaction [F(2, 36) = 5.11; p = .003; partial g2 = .08] were found〞see Fig. 1〞confirming our hypothesis about the different course of mood changes in the crying and noncrying group. No main effect of the group [F(1, 55) = .83; p = .365; partial g2 = .02] was observed.",1
9,11,"To better understand the observed interaction two separate ANOVAs were performed in order to test whether there was a significant mood change in each of the two groups (p set to .025). There was no significant overall change in NA in the group of non-criers throughout the four measurements [F(3, 27) = 1.20; p = .311; partial g2 = .04]. However, in the group of criers, a significant effect of time was observed [F(3, 23) = 3.95; p = .021; partial g2 = .34]. Post hoc comparisons (Bonferroni correction) revealed that NA increased from T1 to T2 (p\.001), and decreased from T2 to T3 and from T2 to T4 (p\.001), thus supporting our hypotheses about initial deterioration and subsequent recovery of mood in criers. Most importantly, however, the decrease in NA from T1 to T4 in this group was also significant (p = .013), thus supporting our hypothesis about the overall mood improvements following crying. Finally, the predicted decreases in NA remained significant (recovery: p\.001; overall mood improvement: p = .007) when NA change from T1 to T2 was included as a covariate in an additional ANOVA.",1
9,13,"Perhaps it is in particular the strong mood improvement experienced by those participants who cried that fuels the popular notion that crying brings relief. It is obvious that decreases in NA from T2 to T4 and from T3 to T4 in participants who cried are mainly the consequences of previous (i.e., T1每T2) NA increases, that is, the return to baseline levels. This finding may explain why people report mood improvement after crying: those who cried indeed experience greater mood changes, be it after an initial deterioration. Such strong mood recovery, as well as the observed return of NA even to below baseline levels thus seems to support the hypothesis about the cathartic effects of crying. These findings are in accordance with both of our hypotheses about the negative effects of crying over the short run and about mood increases that follow crying over the longer run. On a more general level, these findings can be compared to the short-term negative and long-term positive effects of the expression of emotion on mood and well-being (Pennebaker 1997; Smyth 1998). However, the question remains whether these long-term mood-enhancing effects of crying and of other types of emotion expression are mediated by the same cognitive, physiological, or behavioral mechanisms.",1
9,14,"One could argue that the observed general decline in NA reported by criers at the final measurement is the consequence of increased tension and nervousness of the study participants at the beginning of the experiment, due to the fact that they are in a new and uncertain situation, rather than being the result of crying. However, if this mood improvement is considered as a kind of return to the (preexperiment) baseline level, it remains unclear why noncriers did not end up with improved mood at the final relative to the first measurement. Also note that both groups did not differ in NA at T1.",1
9,15,"A final critical and still unanswered question is whether the observed decreased NA really reflects a different mood state, induced by the crying, or that it reflects a kind of response shift, a phenomenon, which is well-known in the literature on quality of life in cancer patients. Repeatedly it has been found that cancer patients report a better quality of life than before their disease, when comparing their absolute scores on quality-of-life measures. However, when being asked to compare directly their current quality of life with before their disease (as is also done in retrospective studies on mood changes after crying), they indicate unanimously that their current state is worse than before their disease (Schwartz and Sprangers 1999). This response shift might be the result of changes in internal standards, conceptualization of the concepts, and/or one＊s values. This methodological issue certainly needs adequate consideration in future studies, for example by including a measure asking participants to compare directly their current mood state to the pre-film measurement. For future studies, we also suggest to pay an additional attention to factors that influence the memory of emotional events and mood, to stable individual differences related to affect intensity and variability, as well as to mood regulation processes.",1
9,16,"In conclusion, the present findings suggest a simple, obvious, and parsimonious explanation for the paradoxical findings of different studies investigating the effects of crying on mood. After the initial deterioration of mood following crying that is usually observed in laboratory studies, it takes some time for the mood, not just to recover, but also to increase above the levels that it had before the emotional event, a pattern of findings which corresponds to the results of retrospective studies.",1
10,1,"Transient brain responses to cues indicating the potential for reward may not be the only mechanism that links incentive information to enhanced cognitive control. It is possible that information about potential rewards may change cognitive processing and brain activity during the entire task in a more sustained fashion. A more recent line of research has examined state-dependent reward context effects on cognitive control, providing evidence for the presence of motivation-related Bstate effects on cognitive function, as evidenced by increased sustained activations across blocks of trials with incentive information (Engelmann et al., 2009; Jimura et al., 2010; Locke & Braver, 2008). For example, in a study by Engelmann et al. (2009) using a Posner-type task in which cues indicated the location of the face target stimulus, motivation was manipulated in a blocked fashion by varying the valence (e.g., winning, avoiding loss) and magnitude of the rewards associated with task performance (e.g., winning $1 or $4, or avoid losing $2.5 or $0). They found that in several regions in a fronto-parietal attentional network (i.e., the posterior intraparietal sulcus, middle frontal gyrus, the caudate, and putamen), cue-related responses were modulated by the incentive values. Importantly, they also found that several regions thought to be involved in the control of attention (e.g., the intraparietal sulcus and middle frontal gyrus) showed increased sustained activations across the course of blocks with greater incentive values. These results suggest that the enhancing effects of rewards on cognitive control can be evidenced in at least two ways: by (1)increases in cue-related responses, and (2)increases in sustained responses.",1
10,2,"Importantly, providing rewards or incentives does not lead to changes in behavioral performance and brain activity in all individuals. A growing body of research suggests that individual differences in reward-related sensitivity may modulate behavioral and neural responses to either primary (e.g., food) or secondary (i.e., monetary incentives) rewards (e.g., Beaver et al., 2006; Cooper, Duke, Pickering, & Smillie, 2014; Jimura et al., 2010; Locke & Braver, 2008). Specifically, several studies have reported associations between individual differences in reward-related personality traits and reward-related neural activations (e.g., Beaver et al., 2006; Cohen, Young, Baek, Kessler, & Ranganath, 2005; Cooper et al., 2014; Jimura et al., 2010; Locke & Braver, 2008). For example, Beaver et al. (2006) found that individual differences in Behavioral Inhibition and Behavioral Approach Systems (BIS/BAS) drive scores (i.e., items asking about the pursuit of goals) were significantly associated with neural responses to appetizing relative to bland foods in the ventral striatum and orbitofrontal cortex. Cohen et al. (2005) found that when participants received immediate monetary rewards during a gambling task, people higher in extraversion showed a greater magnitude of neural response related to reward receipt versus no reward in the right medial orbitofrontal cortex, amygdala, and right nucleus accumbens. More recent work by Jimura et al. (2010) also showed positive associations between sustained DLPFC activations during reward context and reward sensitivity from the BAS. Thus, personality traits related to reward drive and sensitivity may be factors for understanding individual differences in incentive effects on cognitive control.",1
