index_article,index_paragraph,content,label
4,59,"Reducing the number of familiar names increased the accuracy of recognition for those items from d' = 2.11 in Experiment 2 to d' = 2.76 here. It thereby increased the difference in accuracy between the familiar and unfamiliar items. This had the expected effect of recovering the Mirror Effect according to the H/FA Index (see line 2 of Table 3.) It had the unexpected effect, however, of also increasing the bias difference by making the responses to the familiar names more liberal. This effect is of considerable interest. It indicated that an experimental operation may have a double effect: a change in accuracy and a change in bias. The reason for the bias change may be that familiar names generate relatively liberal responses initially (as in Experiment 2) because they are more salient for participants. When we reduced the number of familiar names in the present experiment, we increased their salience further and thus increased further the tendency for liberal responses (see Wickens, 2002, on the relation of salience to bias).",1
4,60,"Our contention is that SDT with its three basic concepts 每 sensitivity, bias, and LR decision axis explains the three regularities. It also explains when the mirror regularity does not appear. There are process models of recognition memory that incorporate SDT and its LR component (McClelland & Chappell, 1998; Shiffrin & Steyvers, 1997). There is no conflict between such models and the more general SDT model considered here. What is involved are two different levels of theory (Marr, 1982).",1
4,61,"LR decisions need not be invoked to explain the data of a simple one-condition memory experiment such as the one represented in Fig. 1. The assumption that decisions are made on the basis of unprocessed ※strength§ will do. When we move to two-condition experiments such as the one represented in Fig. 2 simple strengthbased decisions fail. This can be seen by taking the same parameters used there: SN and WN are Normal(米=0,考=1), WO is Normal(米=1,考=1) and SO is Normal(米=1.75,考=1). If we omit the LR conversion from the computations then none of the regularities appear. The initial new distributions do not move: doo = .75 but dnn = 0, no Mirror Effect. The slopeoo = slopenn = 1.0: no Variance Effect. And lenW = lenS = 5.66: no Length Effect.",1
4,62,"It is, of course, possible to hold on to strength decisions by adopting additional, ad hoc assumptions, to explain a regularity. To date, two such proposals have been made to explain the Mirror Effect: Criterion Shift and Two-Process. Their ad hoc assumptions are indicated below.",1
4,63,"There is ample evidence, however, that WN and SN do not stay fixed. Experiments on forced choice in which participants were required to choose WN versus SN items, called null choices, showed that the two new distributions are separated, SN < WN ( Glanzer et al., 1991, 1993; Hilford et al., 1997; Kim & Glanzer, 1995). In all five experiments reported here dnn is negative (see Table 3), indicating again that the two new distributions are separated, SN < WN with distance -dnn.",1
4,64,"A popular explanation of the Mirror Effect, is the two-process explanation, e.g., Balota, Burgess, Cortese, and Adams (2002). This explanation is limited to the word frequency Mirror Effect (seen in Experiment 1). It makes the following assumptions: (1) Individuals use a familiarity/ strength decision axis, unconverted; (2) process one: Low frequency new (LN) words start out situated lower on the familiarity/strength decision axis than high frequency new (HN) words because they are less familiar (ad hoc assumption). This gives one of the inequalities that define the Mirror Effect, LN < HN; (3) process two: Low frequency words are learned and recollected much more effectively than high frequency words, overcoming the initial position difference (ad hoc assumption). This gives the second inequality, HO < LO, of the Mirror Effect. The three assumptions in combination produce the Mirror Effect, LN < HN < HO < LO.",1
4,65,"To support the explanation, the Mirror Effect is first shown in a baseline condition. Then an operation is carried out, e.g., speeded presentation, that disrupts the Mirror Effect (using the H/FA Index). This is interpreted as a result of disruption of recollection. The two-process explanation is limited in two ways: (1) It explains only the word-frequency mirror effect, not, as will be shown, the name familiarity mirror effect (Experiments 2, 3, 4 and 5), and (2) it does not cover the other two regularities, the Variance Effect and the Length Effect",1
4,66,"The LR SDT interpretation of the mirror disruption as a result of speeding differs. L words require more processing time than H words (Glanzer & Adams, 1990; Wright, 1979). Speeding therefore has a differential effect on L versus H words. It decreases the accuracy for both L and H words but more so for L words. It therefore decreases the difference in accuracy, d＊, between the two conditions. In Glanzer et al. (2009) and in Experiment 5 we showed that the size of the accuracy difference between conditions was critical for the H/ FA Index of the mirror effect. If there is any differential bias, the smaller the d＊ difference, the less likely the H/FA Index (used in the two-factor mirror disruption studies) will show the mirror effect.",1
4,67,"SDT with its LR decision axis handles the data summoned to support the two-process explanation without postulating any additional processes such as familiarity and recollection. It is not, moreover restricted to the explanation of word frequency effects as is the two-process explanation",1
4,68,"Finally and more generally, Experiments 2, 3, 4, and 5 rule out a two-process explanation and, more generally, any explanation that assumes a strength/familiarity decision axis. Such explanations require that the unfamiliar new names (UN) should be lower than familiar new names (FN) on the decision axis, UN < FN. Therefore no mirror effect should occur. SDT with its LR decision axis predicts the reverse order, FN < UN, and a full Mirror Effect.",1
4,69,"Our finding that familiarity produces a Mirror Effect is supported by evidence from five other studies on recognition that have varied familiarity of words, names, faces, and tunes (B?ckman 1991; B?ckman & Herlitz, 1990; Bartlett, Halpern, & Dowling, 1995; Brown, Lewis, & Monk, 1977; Schulman, 1976). Those investigators use different names for the familiarity variable, e.g., prior knowledge, but it is clear that the two sets of items used in each study differ in initial familiarity.",1
4,70,"Rouder and his co-authors have raised questions about the legitimacy of statements about the relation of asymmetry of ROCs (slopes other than 1.0 of z-ROCs) to the variance of the underlying distributions. Rouder, Pratte, and Morey (2010) challenged results presented by Mickes, Wixted, and Wais (2007) in support of the relation between slopes and variance in the normal unequal variance SDT model. Rouder et al. presented z-ROCs from other models (e.g., log normal, inverse probit transforms of normal) with other variances that mimic the Mickes et al. findings. They concluded that ※there is no principled method for assessing the relative variability of latent mnemonic strength distributions§ (p. 427). The argument has, however, been rebutted in detail by Wixted and Mickes (2010). The controversy cannot be resolved here. It requires, at a minimum, a demonstration by Rouder et al. that the alternative models proposed do as good a job as the standard SDT normal models with a range of data. Wixted and Mickes (2010) present analyses that they do not.",1
4,71,"Pratte, Rouder, and Morey (2010) are concerned with a different presumed problem in interpreting ROC asymmetries (z-ROC slopes less than 1.0). Their concern is whether they are an artifact of ※distortions due to averaging data over items§ (p. 224). They conclude, however, that ※Application of a hierarchical unequal-variance signal detection model reveals that asymmetries are in fact a real phenomenon and do not reflect distortions from averaging data§ (p. 224).",1
5,1,"Interest has flourished in studying both the spatial and temporal aspects of eye movement behavior. This has sparked the development of a large number of new methods to compare scanpaths. In the present work, we present a detailed overview of common scanpath comparison measures. Each of these measures was developed to solve a specific problem, but quantifies different aspects of scanpath behavior and requires different data-processing techniques. To understand these differences, we applied each scanpath comparison method to data from an encoding and recognition experiment and compared their ability to reveal scanpath similarities within and between individuals looking at natural scenes. Results are discussed in terms of the unique aspects of scanpath behavior that the different methods quantify. We conclude by making recommendations for choosing an appropriate scanpath comparison measure.",1
5,2,"We describe the scanpath comparison methods that have been introduced in the literature. In each case, we give a short description, and the reader is advised to consult the original publications for further details. Additional mathematical details are provided in the Appendix.",1
5,3,"One successful way for comparing scanpaths is based on the string-edit distance (Bunke, 1992; Levenshtein, 1966; Wagner & Fischer, 1974), which is used to measure the dissimilarity of character strings. In this method, a sequence of transformations (insertions, deletions, and substitutions), is used to transform one string into the other and their similarity is represented as the number of transformation steps between the two strings. This method has been adapted for comparing the similarity of scanpaths (Brandt & Stark, 1997; Foulsham & Kingstone, 2013; Foulsham & Underwood, 2008; Harding & Bloj, 2010; Underwood, Foulsham, & Humphrey, 2009). To achieve this, a grid is overlaid on an image, and each cell in the grid is assigned a unique character. Fixation sequences are then transformed into a sequence of characters by replacing the fixation with the character corresponding to the grid cell the fixation falls in. The dissimilarity of two scanpaths can then be represented by the number of transformations required to convert the string corresponding to the first scanpath to the string corresponding to the second scanpath.",1
5,4,"The string-edit measure has been used on a similar dataset previously in Foulsham and Underwood (2008), where similarity was found to be highest for scanpaths generated from the same person looking at the same image. In addition, in Foulsham et al. (2012), similarity in shape was highest for the same person looking at the same image. Given that the stringedit distance measure is most sensitive to similarities in shape and sequential information, we expect that string edit similarity scores should be quite high between scanpaths of the same person looking at the same image for a second time, convergent with these earlier results.",1
5,5,"Cristino et al. (2010) proposed a generalized scanpath comparison method that addresses many of the deficiencies of the string-edit distance method. Their generalization aligns eye movement sequences based on the Needleman-Wunsch algorithm, which is used in bioinformatics to compare DNA sequences. In their method, scanpaths are spatially and temporally binned and then recoded to create a sequence of letters that retains fixation location, duration, and sequence information. The two character sequences are compared by maximizing the similarity score computed from a substitution matrix, which in turn provides the score for all letter pair substitutions and a gap penalty. Critically, the substitution matrix can encode information about the relationship between specific regions of interest, thus providing the opportunity to include semantic information in the similarity measure.",1
5,6,"Since ScanMatch quantifies spatial, sequential, and duration information together, we expect ScanMatch to do well in revealing within-participant scanpath similarity, and in particular, the strong similarity between observers viewing the same image twice (see Foulsham et al., 2012).",1
5,7,"Shepherd et al. (2010) introduced several measures for assessing the similarity of two scanpaths. For each of the measures, the scanpaths are first resampled uniformly in time (at 60Hz), and truncated to the shorter length. These measures are sample-based, in that they do not require pre-processing of eye-tracking data into discrete fixation-saccade sequences via saccade and velocity thresholds.",1
5,8,"The overlap between two scanpaths yields a similarity measure that is sensitive to temporal and spatial differences between fixation locations. It does not take into account fixation duration, rather it uses the resampling to capture aspects of temporal similarity. Thus, this method preserves temporal ordering but does not account for differences in fixation times. As a result, two scanpaths could have the same spatial positions but different fixation durations, and this method would then evaluate them as not overlapping and therefore being very different. For example, if one scanpath lagged behind another by one fixation but was otherwise spatially overlapped, this method would evaluate the two sequences as very different. One drawback of this method is that it uses an arbitrary, pre-defined radius threshold, with similar disadvantages to the grid-based quantization of string-edit and ScanMatch.",1
5,9,"Fixation overlap is extremely sensitive to differences in absolute timing between two scanpaths, but is slightly less sensitive to differences in position (due to the use of the radius). Given these sensitivities, it is reasonable to expect this measure to perform similarly to the ScanMatch measure, which is also sensitive to the spatial and temporal similarities between two scanpaths.",1
5,10,"This measure is very sensitive to temporal and spatial differences between the two scanpaths. The sensitivity to temporal differences can be advantageous when timing is important, e.g., when the stimuli change over time, such as in videos. The correlation measure is also sensitive to small differences in fixation positions, given that there is no spatial quantization of the fixations. A significant advantage of this method is its use of the straightforward and readily interpretable correlation analysis. This measure is more sensitive to similarities in position than the fixation overlap method, while also taking sequential information into account. However, this strong spatial-temporal sensitivity may be less robust to noisy data than other measures that employ a grid or radius.",1
5,11,"Shepherd and colleagues＊ (2010) gaze-shift measure assesses how similar the saccade times and amplitudes are between two scanpaths. Gaze shift is computed as the correlation between the absolute values of the first derivative of each scanpath and is computed in the same manner as the temporal correlation, but using the first derivative instead of the position",1
5,12,"For smoothing and for computing the derivatives of the scanpaths, each scanpath is convolved with the derivative of a Gaussian filter. Gaze shift is sensitive to the amplitude of the saccade as well as to its temporal location. It reflects how similar two scanpaths are in terms of the sequence of large and small saccades. This captures some aspects of a global viewing strategy, as subjects who make small saccades within a localized region would have very different scanpaths than subjects who make large saccades within the entire visible area. This is also useful for comparing dynamic stimuli (e.g., video) to assess how subjects respond to temporal changes in the scene.",1
5,13,"The gaze-shift measure quantifies similarity in amplitudes, and might correspond well with the MultiMatch measure that quantifies similarity in scanpath length. In Foulsham et al. (2012), similarity in length was only consistent for the within/ between-image comparison. One might expect a similar result for the gaze-shift measure; however, prediction is difficult because it simultaneously quantifies, like the other samplebased measures, temporal similarity",1
5,14,"The most significant advantage of the linear distance method is that it does not need to be quantized as in the string-edit method. It simply compares each fixation in one scanpath with the fixations in another in terms of their spatial similarity. However, by comparing only nearest neighbor fixations in terms of distance, this method ignores sequential information. To address some of these issues, Mannan et al.＊s (1995) method was modified by Henderson, Brockmole, Castelhano, & Mack (2007) to enforce a one-to-one mapping between two scanpaths, provided that they have the same length. The results for the two methods are very similar (Foulsham & Underwood, 2008), which is likely due to the fact that Mannan et al. average the distances from the first to the second and from the second to the first scanpath, hence clusters of fixations in one scanpath are averaged out. For this reason, we used only Mannan et al.＊s (1995) original method in our analyses. Linear distance is a measure that specifically quantifies and compares the fixation positions in two scanpaths, regardless of the order of fixations. Given that scanpath position comparisons have previously revealed an advantage for within-participant similarity (Foulsham et al., 2012), we expect this method to perform well in comparing within- and between-participant scanpath similarity.",1
5,15,"Recently, Jarodzka, Holmqvist, and Nystr?m (2010), Dewhurst et al. (2012), and Foulsham et al. (2012) introduced the MultiMatch method for comparing scanpaths. The MultiMatch methods consists of five separate measures that capture the similarity between different characteristics of scanpaths, namely shape, direction, length, position, and duration. Computation of each MultiMatch measure begins with scanpath simplification, which involves combining iteratively successive fixations if they are within a given distance or within a given directional threshold of each other. This simplification process aids in reducing the complexity of the scanpaths while preserving their spatial and temporal structure",1
5,16,"Following this simplification, scanpaths are aligned based on their shape using a dynamic programming approach. The alignment is computed by optimizing the vector difference between the scanpaths (note, however, that scanpaths may be aligned on any number of dimensions in MultiMatch). This alignment reduces the comparison＊s sensitivity to small temporal or spatial temporal variations, and allows the algorithm to find the best possible match between the pair of scanpaths. All subsequent similarity measures are computed on these simplified, aligned scanpaths. The MultiMatch similarity computations presented here follow the implementation described in Dewhurst et al. (2012).",1
5,17,"Vector similarity is computed as the vector difference between aligned saccade pairs, normalized by the screen diagonal and averaged over scanpaths. This measure is sensitive to spatial differences in fixation positions without relying on pre-defined quantization. It is a measure of the overall similarity in shape between two fixation-saccade sequences.",1
5,18,"Length similarity is computed as the absolute difference in the amplitude of aligned saccade vectors, normalized by the screen diagonal and averaged over scanpaths. This measure is sensitive to saccade amplitude only, not to the direction, location, or the duration of the fixations.",1
5,19,"Direction similarity is computed as the angular difference between aligned saccades, normalized by 羽 and averaged over scanpaths. This measure is sensitive to saccade direction only, but not to amplitude or absolute fixation location.",1
5,20,"Position similarity is computed as the Euclidean distances between aligned fixations, normalized by the screen diagonal, and averaged over scanpaths. This measure is sensitive to both saccade amplitudes and directions.",1
5,21,"Duration similarity is computed as the absolute difference in fixation durations of aligned fixations, normalized by the maximum duration and averaged over scanpaths. This measure is insensitive to fixation position or saccade amplitude.",1
5,22,"The main advantage of the MultiMatch method is that it provides several measures to choose from for assessing scanpath similarity, and each measure on its own captures a unique component of scanpath similarity. Given the multiplicity of measures, it remains, however, difficult to assess which measure, or which set of measures, is most applicable in a given scenario. Furthermore, because each scanpath is initially simplified it is also not clear how robust each measure is to scanpath variations.",1
5,23,"Given that the MultiMatch measures have already been evaluated with a dataset similar to the one generated for the present work, we expect to essentially replicate those earlier results, where saccade direction, fixation position, fixation duration, and shape similarity were found to be higher for withinparticipant compared to between-participant comparisons.",1
5,24,"To characterize cross-recurrence patterns, we have developed several measures that are based on the recurrence quantification analysis (RQA) for characterizing gaze patterns of a single observer (Anderson et al., 2013). These measures are introduced briefly below and described in detail in the Appendix.",1
5,25,"Consider two fixation sequences f and g that have the same lengths. For sequences of unequal length, the longer sequence is truncated. Within these sequences, any two fixations fi and gj are cross-recurrent if they match or are close together, i.e., if their distance is below a given threshold. In the following, we introduce several measures that we have found useful for characterizing cross-recurrent patterns.",1
5,26,"The cross-recurrence measure of two fixation sequences represents the percentage of cross-recurrent fixations, i.e., the percentage of fixations that match between the two fixation sequences. Cross-recurrence is higher the more spatially similar two fixation sequences are and quantifies their similarity in shape. It is invariant to differences in fixation sequence order as fixations are considered recurrent only if they overlap in position. Given that cross-recurrence quantifies similarity in position, results should be most in line with the linear distance measure and the MultiMatch position measure.",1
5,27,"The determinism measure represents the percentage of cross-recurrent points that form diagonal lines in a recurrence plot and represents the percentage of fixation trajectories common to both fixation sequences. That is, it quantifies the overlap of a specific sequence of fixations, preserving their sequential information (see Fig. 5). An advantage of this measure is that it provides unique information about the type of similarity between two scanpaths. Although two scanpaths may be quite dissimilar in their overall shape or fixation positions, this measure may show whether certain smaller sequences of those scanpaths may be shared.",1
5,28,"Laminarity is a measure of repeated fixations on a particular region that are common to both scanpaths. Laminarity is closely related to determinism. If both laminarity and determinism are high, then in both scanpaths fixations tend to cluster on one or a few particular locations and remain there across several fixations. If laminarity is high, but determinism is low, then it quantifies the number of locations that were fixated in detail in one of the fixation sequences, but only fixated briefly in the other fixation sequence. It is a measure of the clustering of fixations across two sequences.",1
5,29,"Finally, the center of recurrence mass (CORM) is defined as the distance of the center of gravity of recurrences from the main diagonal in a recurrence plot (see Dale et al., 2011b for another method to quantify leading and following in cross-recurrence). The CORM measure indicates the dominant lag of cross-recurrences. Small CORM values indicate that the same fixations in both fixation sequences tend to occur close in time, whereas large CORM values indicate that cross-recurrences tend to occur with either a large positive or negative lag. This is a measure of whether one scanpath may lead (positive lag) or follow (negative lag) its paired scanpath. Their overall similarity in shape or position may be different, but offset, such that one sequence proceeds in a particular trajectory, and the other follows the same trajectory only later on in time (e.g., a few fixations later). In the present work, we use the absolute value of CORM rather than averaging over positive and negative values as we do not have any specific predictions about whether leading or following is more likely to happen in one particular condition or another. Overall, we might predict low corm values for within-image, within-participant comparisons if participants consistently lead or follow a similar scanpath closely (i.e., with a low positive or negative lag) on a later viewing of the same image.",1
