index_article,index_paragraph,content,label
3,5,"The goal of the present study was to further investigate the role of attention in action-specific perception by expanding on the anxi ety study conducted by Ca?al-Bruland et al. (2010). In this pre vious study, only perceived size and performance outcomes were measured. Thus, there was no direct evidence that the change in action-specific perception was due to a shift in the performer＊s attentional focus. However, previous research has demonstrated direct links between performance success, attentional focus, and movement kinematics under pressure conditions. For example, using a baseball batting task with college players, Gray (2004) found that a combination of competitive and evaluation pressure resulted in poorer batting performance, an increase in skill focused (internal) attention (i.e., batters performed better in a sec ondary task that involved judging the direction of bat movement), and a significant change in kinematics (specifically, an increased amount of variability in the timing of the different stages of their swing).",1
3,6,"Similarly, in golf putting an increase in skill-focused at tention (produced either by pressure or the introduction of a sec ondary task that involves making judgments about the movement of the putter) can produce both an increase in putting error and a change in putting kinematics (Beilock and Gray 2012;Gray, Allsop & Williams, 2013). In this case, the kinematic changes were an increase in club-ball impact velocity, a decrease in the time to peak speed, and a change in the relationship between downswing amplitude and putting distance. It is notable that all of these kinematic characteristics are typical of novice golfers (Delay, et al. 1997). See also Lohse et al. (2010) and Cooke et al. (2010) for similar findings. To our knowledge, no previous studies have examined how these changes in movement kinemat ics are related to the perceived size of the target object. Furthermore, although links between attentional focus and per ceived size have been inferred through looking at fixation patterns (Wood et al. 2013;Grayetal.2014), to our knowledge no previ ous studies have directly manipulated attentional focus and mea sured the effect on perceived size.",1
3,7,"In the present study, we sought to investigate the link be tween perceived size, performance outcomes, attentional focus, and movement kinematics in a golf putting task by measuring each of these variables and assessing how they change under pressure. Specifically, in conjunction with performing a putting task, participants were asked to estimate the size of the golf hole under nonpressure pre- and posttests and a pressure condition. The pressure condition involved a combination of competitive (monetary incentive) and evaluative (performance recorded and results distributed) pressure. The attentional probe method ology was used to assess the extent to which participants were focusing their attention on the hole or the movement of their club-head (Gray 2004; Gray and Allsop 2013). Finally, time to peak speed (TTPS)wasusedastheprimarykinematicmeasure, because it has been shown to be related to skill level in golf and be influenced by pressure (Beilock and Gray 2012).",1
3,8,"A total of 25 (17M, 8F) right-handed, experienced golfers enrolled from the School of Sport, Exercise & Rehabilitation Science program atthe University ofBirmingham participated in the study. Their mean age, mean handicap, and mean number of years competitive playing experience were 20.1 (SE =0.4) years, 7.3 (SE = 0.6) strokes, and 6.2 (SE = 0.8) years respec tively. Ethical approval was granted by the Science, Technology, Mathematics and Engineering (STEM) Ethical Review Committee at The University of Birmingham.",1
3,9,"AMcGregorM220, 35-in (88.9 cm), right-handed putter and Wilson Ultra golf balls (size 1.68 in [4.27 cm]) were used. The artificial putting mat had a width of 1.4 m and a length of 4.6 m.The putting taskrequired participants to putt a golf ball towards a 16.5-cm diameter red circle placed on the surface of the green. Participants were instructed to Bstop the ball as close as possible to the centre of the target circle. All putts were made from a distance of 2.5 m. The x/y/z location and angle of the putter head was recorded by mounting a Fastrak (Polhemus) position tracker sensor weighing 10 g on the back side of the putter.",1
3,10,"Estimates of perceived hole size were obtained using the method used by Wood et al. (2013)byaskingparticipantsto draw(using a computermouse)life-sized replicas of the target circle on a monitor using PowerPoint presentation software. The monitor was positioned perpendicular to the target circle at a distance equal to the putting distance (2.5 m). Auditory stimuli for the attentional probes were presented via two speakers (Logitech Model X140) placed at the end of the putting surface at a distance of 3.5 m from the participant. The speakers were placed 10 cm on either side of the hole, a distance determined in pilot experiments.",1
3,11,"Heart rate served as an index of sympathetic nervous sys tem activity and was measured using a heart rate receiver unit (Polar Electro S625X, Polar CIC Inc., USA), which was con nected to a transmitter (Polar Electro coded 31, Polar CIC Inc.) with moistened electrodes positioned across the lower mid thorax. Average heart rate was calculated for the different phases described below.",1
3,12,"The experiment was divided into four phases all completed within one 1.5-hour session: practice, pretest, pressure, and posttest. Participants were given 10-minute breaks between each phase. In all test phases, participants saw the final posi tion of the ball on the green.",1
3,13,"During this phase, participants took 20 putts under normal, single-task conditions. These trials allowed par ticipants to become comfortable with the sensor mounted on the back of the putter as well as to familiarize themselves with our putting task. They were not required to perform the hole size estimate during this phase. Following each putt, the ex perimenter measured the radial distance between the center of the target and the final position of the ball (in cm).",1
3,14,"Position tracker data from these practice trials was used to measure the timing of the putting stroke for each participant (Beilock and Gray 2012). This timing information was later used to control stimulus presentation for one of the secondary tasks as described below. For each putting stroke, we deter mined the instant in time when the putter began moving (STARTt) and the instant in time when the top of the back stroke was reached (BACKt). We then calculated the mean values of these variables for each participant.",1
3,15,"During this phase, the hole size estimation task was first explained to each participant and was practiced five times (without putting). The two secondary tasks were next explained to the participant and practiced five times each (without making the hole size judgment). Both secondary tasks involved the presentation of auditory cues, which were pure tones witha frequency of500Hzanddurationof150ms. The tones were presented via one of the two speakers placed on either side of the hole. Position tracker data taken from the practice trials was used to present the cue at a random time during the participant＊s backswing, i.e., interval between STARTt and BACKt. If the tone was not presented in this interval or occurred at the midpoint of the backswing, the data from that trial was discarded and the trial was re-run. The two secondary tasks were modelled after Beilock and Gray (2012) and were as follows:",1
3,16,"Hole task For this task, participants were required to make a twoalternative forced choice (2AFC) judgmentabout whether the tone presented was playedfromthe speaker tothe left or to the right or the hole. Responses were made verbally (by say ing Bleft or Bright) after the putt was complete (see below).",1
3,17,"Club task For this task, participants were required to make a 2AFC judgment about whether the tone occurred close to the start or the end or their backswing by saying Bstart or Bend after the putting stroke was complete. The tone was presented in the backswing, because our previous research has shown that this is the phase of the putting stroke that is most sensitive to attentional manipulations and golfers can perform this task with a relatively high degree of accuracy (Beilock and Gray 2012).",1
3,18,"After all of the practice trials were completed, participants completed 30 putts. For each putt, participants first completed the stroke and observed where the ball stopped. After each putt, they were then asked to perform the hole size estimation as described above. Finally, they were given a verbal prompt by the experimenter as to which secondary task response was required. The 30 putts were divided into 12 putts with a Hole Task prompt, 12 putts with a Club Task prompt, and 6 putts with a BNo Task prompt for which no secondary task re sponse was required. This ratio of prompt types was similar to that used in our previous study (Beilock and Gray 2012). The order of these prompts was chosen randomly (without replacement) on each trial for each participant. The speaker side on which the tone was presented also was chosen ran domly. Participants were not given any feedback about their hole estimation or the secondary task response.",1
3,19,"Note that we chose to have participants complete the sec ondary task after they made the hole size estimate to avoid the possibility that the former would influence the latter. The sec ondary task prompts were given after the putt was complete and 20 % of trials involved no secondary task judgment with the goal of measuring where the participant＊s attention was focused rather than directing it to a specific location via the secondary task. Because the participant did not know before or during the putt whether they would be asked to make the hole or club judgment, there was no advantage to shifting their attentional focus to one or the other location (Beilock and Gray 2012;Gray 2004; Gray and Allsop 2013). These two secondary tasks were chosen to allow for direct comparison with our previous research. How they might directly interact with the hole size estimation task is discussed in more detail below.",1
3,20,"Pressure phase This phase was identical to the pretest phase except that participants were given instructions prior to put ting designed to increase competitive and evaluation pressure. Before beginning putting, participants read the following script:",1
3,21,"We＊re now moving into a competition phase. Your ob jective in the competition is still to putt the ball as close to the marker as possible. However, throughout the ex periment you have so far accumulated 180 points. For every putt that finishes more than 5 cm from the marker, you will lose 10 points. Prize money of ?50, ?25, and ?10 is up for grabs, for 1st, 2nd, and 3rd place. How many points you manage to hold on to determines your position on the leader board. All the results will be e mailed to everyone who takes part in the study and will be displayed on the notice board in the school atrium. So, everyone will know how everyone else performs. No pressure then Bsaid sarcastically＃good luck!",1
3,22,"Note, this procedure is identical to that used in our previous study on the effects of pressure on golf perfor mance and has proven to produce significant pressure effects (Gray et al. 2013).",1
3,23,The Immediate Anxiety Measures Scale (IAMS; Thomas et al. 2002) was used to assess participants＊ intensity of cognitive and somatic anxiety. The questionnaire was com posed of two items measuring the extent to which partici pants felt cognitively anxious (I was cognitively anxious) and somatically anxious (I was somatically anxious). Responses were made on a 7-point Likert-type scale rang ing from 1 (not at all)to7(extremely). This scale was completed at the end of each phase of the experiment.,1
3,24,"Manipulation check To determine to what extent our pres sure manipulation had the desired effect, the cognitive and somatic anxiety ratings for the IAMS and the heart rate data were subjected to separate one-way repeated measures ANOVAwith phase (pretest, pressure, posttest) as the inde pendent variable",1
3,25,"Task performance There were four main dependent vari ables that were analyzed: mean radial error (MRE), mean perceived hole size (MPS), percentage correct for the Hole secondary task (%Hole), and percentage correct for the Club secondary task (%Club). Each of these variables was first analyzed using separate one-way repeated measures ANOVAwith phase as the independent variable.",1
3,26,"Figure 2 shows the MRE for the two groups across the differ ent phases of the experiment. These data were analyzed using a 2℅3mixedANOVAwithgroup(Choke,Clutch) and phase as factors. This analysis revealed significant main effect of phase [F(2,46) = 22.4, p<0.001, 灰p2=0.49] and a significant group x phase interaction [F(2,46)=3.4,p=0.04,灰p2=0.13].Post-hoc t tests revealed that MRE was significantly higher in the pressure phase for Choke group: t(23)=2.79,p=0.01.All other comparisons were not significant.",1
3,27,"Despite the abundant evidence demonstrating that the action capability of a performer can influence the perceived size of the object(s) that they are acting on, to date there is no clear agreement as to which specific mechanism underlies these effects (see Firestone 2013 vs. Proffitt 2013). One key ques tion that has remained unanswered is what the role is of atten tion in these effects? Do objects look bigger to performers of higher skill level (or performers that have recently been suc cessful), because they are better able to maintain their focus of attention on the target object and this attention serves to ac centuate perception? As discussed above, although previous studies are consistent with the proposal that action-specific effects are mediated by attention (Ca?al-Bruland and van der Kamp2009;Ca?al-Brulandetal.2011;Gray2013;Grayetal. 2014), a direct link has yet to be established.",1
3,28,"The primary goal of the present study was to further investigate this issue by taking advantage of an effect that has been reported in several previous studies on skilled motor performance (reviewed in Beilock andGray2007),namelychokingunderpressure.That is, the introduction of performance pressure often leads to an inward shift in a performer＊s focus of attention. By assessing perceived hole size, performance outcome, and attentional focus in a golf putting task, we sought to es tablish a more direct link between these variables. A sec ondary goal of the present study was to investigate the relationship between movement kinematics and perceived target size. The vast majority of studies in this area have only looked at performance outcomes (Witt and Proffitt 2005; Ca?al-Bruland and van der Kamp 2009; Lee et al. 2012; Witt et al. 2008). It hence remained to be determined whether changestothewayinwhichaperformerisexecutinganaction are associated with changes in perceived size of the goal object.",1
3,29,"Consistent with previous research, the addition of pressure resulted in a significant change in the movement kinematics for some (but not all) golfers in the present study (Gray et al. 2013). Specifically, for 11 of25golfers, there was a significant decrease in TTPS (and increase in VI). A shorter TTPS typi cally occurs when a golfer has a very symmetrical putting stroke such that the maximum velocity occurs exactly at the point of ball-club contact: a technique commonly used by novice golfers (Delay et al. 1997). Expert golfers, on the other hand, typically use an asymmetrical putting stroke for which the club-head is still accelerating at the point of contact with the ball, and thus, TTPS (measured relative to start of the stroke) occurs a bit later (Delay et al. 1997).",1
3,30,"The advantage of using an asymmetric putting stroke with a longer TTPS is that the ball maintains contact with the club-head for a short period time after the moment of initial impact which results in the ball rolling more smoothly across the green (Pelz 2000). Therefore, the decrease in TTPS for the golfers in the Choke group in the present study is consistent with a regression to an earlier stage of skill acquisition as proposed by reinvestment theories of choking under pressure (Masters 1992). This idea is further supported by the finding (Fig. 2) that MRE was significantly higher in the pressure phase for the Choke group.",1
3,31,"Also consistent with previous research, this change in put ting kinematics in the pressure phase was associated with an inward shift of attentional focus, i.e., towards skill execution and away from the external environment (Baumeister 1984; Beilock and Gray 2012). As shown in Fig. 4, golfers in the Choke group had a significant decrease in accuracy for the external, secondary task that involved making a judgment relative to the hole location and a significant increase in the accuracy of the internal, skill-focused secondary task that in volved making a judgment about club movement. Together, these findings provide further support for explicit monitoring (and related) theories of choking under pressure in which it is proposed that pressure serves to cause inward shift in attention towards skill execution resulting a perceptual-motor control strategy typical of an earlier stage of skill acquisition (Baumeister 1984).",1
3,32,"There were some important design choices in the present study that could have influenced the pattern of results and should be examined further in future research. First, partici pants were allowed to see the final position of the ball after each putt. As proposed by Proffitt and Linkenauger (2013), this knowledge of results could have provided a scaling metric for the perceived hole size judgments (i.e., the size estimate was related to the variability of final ball locations). However, although there is some indirect evidence in support of this hypothesis (Ca?al-Bruland et al. 2012), in a more recent study we have shown that when performance variability was directly manipulated perceived target size remained stable independent of performance outcome variability (Foerster et al. 2015). Regardless, it will be important for future studies to examine whether the effects observed in the present study occur when performers are not given knowledge of results as has been done in previous studies (Wood et al. 2013).",1
3,33,"Another design-related issue concerns the timing of the secondary task. In the present study, the secondary taskstimuli used to assess attentional focus were presented during the putting stroke to allow for direct comparison with our previ ous research (Beilock and Gray 2012). Therefore, perfor mance on these tasks could not be used to assess directly the attentional focus before the initiation of the putt. It is possible that the judged size of the target was determined by the atten tional focus of the performer before movement initiation, which could have potentially been different than the focus during the stroke. However, we argue that this was likely not the case. First, previous research on golfer＊s eye movements (which can be used as an in direct measure of attentional focus) has shown that fixation patterns are similar before, during, and after the putting stroke (Vickers 1992). Second, we have shown previously by using an analogous secondary task in a baseball batting experiment that attentional shifts that are induced during the movement can spill over into the be havior that occurs before and after movement (Gray 2006).",1
3,34,"In conclusion, the present study helps to advance under standing of the mechanisms underlying action-specific effects on perception. We provide direct evidence linking the per ceived size of a target with extent to which an actor focuses their attention on that object〞a finding that supports the at tentional accentuation hypothesis. Finally, we show how the relationship between attentional focus and perceived size is accompanied by changes in putting kinematics.",1
4,1,"A basic assumption of Signal Detection Theory is that decisions are made on the basis of likelihood ratios. In a preceding paper, Glanzer, Hilford, and Maloney (Psychonomic Bulletin & Review, 16, 431每455, 2009) showed that the likelihood ratio assumption implies that three regularities will occur in recognition memory: (1) the Mirror Effect, (2) the Variance Effect, (3) the normalized Receiver Operating Characteristic (z-ROC) Length Effect. The paper offered formal proofs and computational demonstrations that decisions based on likelihood ratios produce the three regularities. A survey of data based on group ROCs from 36 studies validated the likelihood ratio assumption by showing that its three implied regularities are ubiquitous. The study noted, however, that bias, another basic factor in Signal Detection Theory, can obscure the Mirror Effect. In this paper we examine how bias affects the regularities at the theoretical level. The theoretical analysis shows: (1) how bias obscures the Mirror Effect, not the other two regularities, and (2) four ways to counter that obscuring. We then report the results of five experiments that support the theoretical analysis. The analyses and the experimental results also demonstrate: (1) that the three regularities govern individual, as well as group, performance, (2) alternative explanations of the regularities are ruled out, and (3) that Signal Detection Theory, correctly applied, gives a simple and unified explanation of recognition memory data",1
4,2,"In a preceding paper, Glanzer et al. (2009) demonstrated that recognition memory performance is consistent with normative Signal Detection Theory (Green & Swets, 1966/1974)1 based on likelihood ratios (LR). The demonstration consisted of three steps:",1
4,3,"Formal proofs that the LR assumption implies three regularities. These regularities, defined shortly, are the Mirror Effect, the Variance Effect, and the normalized Receiver Operating Characteristic (z-ROC) Length Effect, (2) computed examples showing how LR decisions generate the regularities, and (3) a survey of recognition memory data establishing the ubiquity of the three regularities.",1
4,4,"The 2009 paper also briefly discussed two other topics: how bias can obscure the Mirror Effect and also how that obscuring can be countered. Those two topics are developed in detail here. We show that the Mirror Effect 每 measured in the usual way 每 is obscured by bias. We then counter the bias effect in four different ways. (1) by using a more informative index of the Mirror Effect, (2) by canceling the bias with a pay-off arrangement, (3) by using a between-list design, and (4) by increasing the difference in accuracy between the two experimental conditions (familiar vs. unfamiliar names).",1
4,5,"With respect to the survey in Glanzer et al. (2009), the following objection can be made. The surveyed data consisted of pooled group data. It is possible that group data give a different picture of the underlying processes than do individual data. The possible disagreement of group and individual data is discussed at length by Estes (1956) and Estes and Maddox (2005). The results reported here answer that objection by demonstrating that the three regularities govern individuals＊ performance.",1
4,6,"In a recognition memory experiment, participants are shown a study list of items and are later shown a test list consisting of items from the first list (※old§) and items which were not (※new§). They are then asked to judge whether each item is ※old§ (O) or ※new§ (N), a YES-NO task. Or they are asked to rate their confidence that each item is ※old§ or ※new§",1
4,7,"There are many experiments in which individuals are presented with two different kinds of items (e.g., high vs. low frequency words) or two different study conditions (e.g., single vs. repeated presentation) that produce a difference in accuracy. These two-condition experiments are important because they show three regularities that are produced by LR decisions: (1) the Mirror Effect, (2) the Variance Effect, and (3) the z-ROC Length Effect",1
4,8,"When there are two sets of items or conditions in a recognition test that produce a difference in accuracy and the decisions are based on LR, then the superior condition (S) will give better recognition of old items as old and also better recognition of new items as new. In a yes/no recognition test the effect is seen in the mirror symmetric pattern of hits (H) and false alarms (FA):",1
4,9,"When there are two sets of items or conditions in a recognition test that produce a difference in accuracy, decisions based on LR will affect the relative variances of new distributions. SN, the new distribution of the superior condition, will have a larger variance than WN, the new distribution of the weaker, lower accuracy condition. This is a novel general effect, not previously noted in the literature. It is measured using the slope of the z-ROC that plots superior (S) new items ratings against weaker (W) new items ratings, the new/new z-ROC. If decisions are based on LR, the slope will be less than 1.0. Decisions based on LR also produce a parallel effect on the relative variances of the old distributions. SO, old distribution of the S condition, will have a larger variance than WO, the old distribution of the W condition. The effect is measured using the slope of the old/old z-ROC that plots the S old items ratings against the W old items ratings. Again, if decisions are based on LR , the slope will be less than 1.0.",1
